job_title,company_name,location,summary
Data Analyst,Prospect Medical Systems,"Orange, CA","Identifies key capitation data shifts and presents findings.
Compiles capitation payments data for analysis and trending purposes."
Data Analyst,OBMedia,"Los Angeles, CA•Remote","You will have contributed to ongoing company efforts to manage our massive, often noisy, and continuously changing, data streams."
Capital Market Data Analyst,Tala,"Santa Monica, CA","Work with existing and creating new data infrastructure relating to Cap Market deals.
Understand data limitations and capabilities and communicate them to teams…"
Data Analyst,Ernest Packaging Solutions,"Commerce, CA 90040","Assist with software deployments and data integration projects.
Analyze data / systems and develop detailed specifications for implementation."
Associate Data Analyst,The Surplus Line Association of CA,"San Ramon, CA 94583",Compare source document data with database reports to detect errors and ensure completeness and conformity with established policies and procedures.
Data Analyst Reporting Specialist,WSP&D,"Ridgecrest, CA","Check data and reports for accuracy with extreme attention to detail.
Understanding of data analysis, data science, machine learning and statistics."
Data Conversion Analyst,Deloitte,"Sacramento, CA 95814 (Downtown area)+2 locations","Are you an experienced, passionate pioneer in technology?
A system's professional who wants to work in a collaborative environment."
Data Analyst,NoRedInk,California•Remote,"3+ years of professional experience as a data analyst.
You're comfortable using Snowflake or a similar data storage tool."
Expert All Source Analyst,Valiant Integrated Services,"Marysville, CA 95903","Ability to define problems, supervise studies and lead surveys to collect and analyze data to provide advice and recommend solutions."
"IT Data Analyst, Principal",Blue Shield of California,"Oakland, CA","Identify and escalate data & analytics priorities requiring enterprise data & analytics governance review.
Extensive knowledge of healthcare data and advanced…"
"Business Analyst, Hive Media",Hive,"San Francisco, CA","Day to day, you will work with existing and potential clients within the media vertical and deliver on Hive’s offerings to a broad range of Fortune 500…"
Healthcare Data Analyst,Strategic Employment Partners,"Palm Desert, CA 92211•Temporarily Remote","5+ years of data analysis experience.
SSRS, Crystal Reports, Tableau, or any other reporting or data visualization tool.
Temporarily due to COVID-19."
Business Intelligence Analyst,Instacart,"San Francisco, CA•Remote","Investigate and solve complex data issues such as data bugs that impact financial reporting.
Deploy data quality checks and ensure high quality of dashboards…"
Junior Data Analyst with Work Life Culture,Recruiting for Good,"San Diego, CA","Extract summary narratives from raw data.
Seek out new data sources for integration into existing workflows and procedures.
Undergraduate degree: B.S. or B.A."
Research Analyst IV,County of Orange,"Santa Ana, CA","Working with/querying complex data collection/management systems, including understanding and utilizing computer programming and processing methods to generate,…"
Data Analyst Engineer,Seasoned,"San Francisco, CA 94108 (Financial District area)","Experience analyzing data using SQL.
Maintain and assist in data model documentation, data dictionary, and other Data Governance documentation."
Data Analyst,OBMedia,"Los Angeles, CA•Remote","You will have contributed to ongoing company efforts to manage our massive, often noisy, and continuously changing, data streams."
DHM Data Analyst,University of California San Francisco,"San Francisco, CA 94143 (Haight-Ashbury area)",We offer analysts both a small amount of protected time to learn new data science skills and tools as well as a small discretionary budget which can cover the…
"Data Analyst, New Products",Criteo,"Los Angeles, CA","Own and maintain reports/tools in Tableau, Python and other data tools.
Consequently, Criteo may use your personal data in relation to the evaluation and…"
Data Analyst,Enjoy Technology,California•Remote,"Problems not solutions - engineers focus on solving problems, not building solutions handed to them."
Data Analyst,San Antonio Regional Hospital,"Upland, CA 91786","Research analyst for data integration in support of financial, operating, and productivity reporting processes."
Data Analyst,Frontapp,"San Francisco, CA","Build internal tools that support the analytical needs of functional data analysts.
Support internal data automation and enablement efforts in partnership with…"
Data Analyst,Facebook,"Burlingame, CA 94010+3 locations","Own the aggregation and reporting of manufacturing systems data, including – MES data, Shop floor trend data, metrology raw data, metrology production data,…"
Senior Data Analyst,Square,"San Francisco, CA","Great attention to detail; experience delivering exceptional quality in reports and data analysis.
Ability to bring data to life for any audience via written…"
"Tableau Analyst, Junior",Booz Allen Hamilton,"Port Hueneme, CA",Create data visualizations by developing Tableau workbooks and dashboards to help Navy clients synthesize multiple sources of data.
SQL-Based Data Analyst (Remote),Compology,California•Remote,"Previous experience building and maintaining customer facing data exports / visualizations.
Create SQL-based analyses that employees and customers will rely on…"
Data Intelligence Analyst,Cedars-Sinai,"Los Angeles, CA","Experience running or participating in data projects.
Strong Oracle SQL Query skills.
Tableau development skills or similar dashboarding tools."
"Business Intelligence Analyst, Broadcast Media Analytics",GoodRx,California,"Ability to influence cross-functional partners by leveraging data and insights.
Proven ability to interpret data to find insights and drive recommendations."
Data Analyst,RPX,"San Francisco, CA 94105 (Financial District area)","1+ years in data analysis.
Answer complex legal questions with data analysis and visualization.
Develop an understanding of the data in RPX’s proprietary…"
Data Quality Analyst,MemorialCare Medical Foundation,"Fountain Valley, CA 92708","Responsibilities include remaining current with quality metrics measure specifications, data collection, data analysis, generation of reports and providing…"
Data Analyst,Activision,"Santa Monica, CA",The user acquisition analytics role is building the foundation that will shape analytics and automation for user acquisition across Activision.
Data Analyst,Clinica Romero,"Los Angeles, CA 90033","Ability to acquire data from primary and secondary data sources and maintain databases/data systems.
Responsible for database administration, data consolidation…"
Data Analyst,"Universal Audio, Inc","Scotts Valley, CA 95066",You will translate complex business questions into analytic approaches and data sets that can drive a self-service model for analytic data access throughout our…
Assistant Data Analyst- COVID 19 Response (Contract),Brilliant Corners,"Los Angeles, CA 90014 (Downtown area)•Temporarily Remote","Comfort working with data systems and learning new data systems.
The Assistant Data Analyst works within the HFH Policy & Procurement data team and supports the…"
Capital Market Data Analyst,Tala,"Santa Monica, CA","Work with existing and creating new data infrastructure relating to Cap Market deals.
Understand data limitations and capabilities and communicate them to teams…"
Privacy Data Analyst,Facebook,"Menlo Park, CA 94025","3+ years experience in quantitative role in data, reporting, and analytical problem solving.
Independently perform privacy assessments, data reviews, and…"
Data Analyst,DocuSign,"San Francisco, CA 94105 (South Beach area)","Experience with data lakes, ETL, Data pipelining and data warehousing.
Manage data requests in JIRA and summarizes data findings and processes in JIRA and…"
